{
  "instantiation_id": "present80-rkdiff24-upper-bound-instantiation-v1",
  "target_primitive_id": "present80",
  "target_attack_id": "present80-rkdiff-characteristic-upper-bound-24r",
  "target_global_plan_id": "present80-rkdiff24-upper-bound-v1",
  "backend": "milp",
  "source_refs": [
    {
      "kind": "attack_paper",
      "label": "ePrint 2013/676",
      "location": "Sect. 2.2, Sect. 4, Appendix A.1",
      "url": "https://eprint.iacr.org/2013/676"
    },
    {
      "kind": "primitive_paper",
      "label": "PRESENT CHES 2007",
      "location": "Section 3, round structure and 80-bit key schedule",
      "url": "https://www.iacr.org/archive/ches2007/47270450/47270450.pdf"
    },
    {
      "kind": "schema",
      "label": "Local model artifacts",
      "location": "primitive_spec, attack_spec, local_semantics, global_model_plan from the same trial"
    }
  ],
  "assumptions": [
    "The execution-facing artifact intentionally stops before concrete LP emission; it specifies what an emitter must instantiate, not the final emitted file.",
    "The lower-bound phase models rounds 1 through 12 because Appendix A.1 derives the 24-round claim from a 12-round lower bound and applies it to two consecutive windows.",
    "For the 12-round lower-bound unit, round keys K1 through K12 are required; this means key-schedule updates 1 through 11 are modeled, while the update after round 12 is omitted because K13 is unused in this unit.",
    "The PRESENT S-box is bijective with branch number 2, so Eq. (5) is omitted in this instantiation because Sect. 2.2 says it is redundant in that case.",
    "XORing the round counter constant into key-register bits k19..k15 does not change XOR-difference bits, so the difference model may copy the post-S-box key-register state into the next-round key register."
  ],
  "variable_families": [
    {
      "family_id": "state_pre_round",
      "variable_kind": "difference_bit",
      "binary": true,
      "naming_pattern": "s_r{round}_b{bit}",
      "index_dimensions": [
        {
          "name": "round",
          "start": 1,
          "end": 13
        },
        {
          "name": "bit",
          "start": 0,
          "end": 63
        }
      ],
      "semantic_role": "Bit-level XOR-difference variables for the encryption state at the input boundary of each round; round 13 is the post-pLayer boundary after round 12.",
      "notes": "Bit indices follow the primitive spec convention."
    },
    {
      "family_id": "state_after_ark",
      "variable_kind": "difference_bit",
      "binary": true,
      "naming_pattern": "sa_r{round}_b{bit}",
      "index_dimensions": [
        {
          "name": "round",
          "start": 1,
          "end": 12
        },
        {
          "name": "bit",
          "start": 0,
          "end": 63
        }
      ],
      "semantic_role": "Bit-level state difference immediately after addRoundKey in each round."
    },
    {
      "family_id": "state_after_sbox",
      "variable_kind": "difference_bit",
      "binary": true,
      "naming_pattern": "ss_r{round}_b{bit}",
      "index_dimensions": [
        {
          "name": "round",
          "start": 1,
          "end": 12
        },
        {
          "name": "bit",
          "start": 0,
          "end": 63
        }
      ],
      "semantic_role": "Bit-level state difference immediately after the 16 parallel encryption S-boxes in each round."
    },
    {
      "family_id": "round_key_bits",
      "variable_kind": "difference_bit",
      "binary": true,
      "naming_pattern": "rk_r{round}_b{bit}",
      "index_dimensions": [
        {
          "name": "round",
          "start": 1,
          "end": 12
        },
        {
          "name": "bit",
          "start": 0,
          "end": 63
        }
      ],
      "semantic_role": "Bit-level XOR differences of round keys K1 through K12."
    },
    {
      "family_id": "key_reg_pre_round",
      "variable_kind": "difference_bit",
      "binary": true,
      "naming_pattern": "k_r{round}_b{bit}",
      "index_dimensions": [
        {
          "name": "round",
          "start": 1,
          "end": 12
        },
        {
          "name": "bit",
          "start": 0,
          "end": 79
        }
      ],
      "semantic_role": "Bit-level XOR differences of the 80-bit key register before round-key extraction in rounds 1 through 12."
    },
    {
      "family_id": "key_reg_after_rotate",
      "variable_kind": "difference_bit",
      "binary": true,
      "naming_pattern": "kr_u{update}_b{bit}",
      "index_dimensions": [
        {
          "name": "update",
          "start": 1,
          "end": 11
        },
        {
          "name": "bit",
          "start": 0,
          "end": 79
        }
      ],
      "semantic_role": "Bit-level XOR differences after the key register is rotated left by 61 in updates 1 through 11."
    },
    {
      "family_id": "key_reg_after_sbox",
      "variable_kind": "difference_bit",
      "binary": true,
      "naming_pattern": "ks_u{update}_b{bit}",
      "index_dimensions": [
        {
          "name": "update",
          "start": 1,
          "end": 11
        },
        {
          "name": "bit",
          "start": 0,
          "end": 79
        }
      ],
      "semantic_role": "Bit-level XOR differences after the top nibble of the rotated key register passes through the PRESENT S-box."
    },
    {
      "family_id": "ark_xor_dummy",
      "variable_kind": "xor_dummy",
      "binary": true,
      "naming_pattern": "dx_r{round}_b{bit}",
      "index_dimensions": [
        {
          "name": "round",
          "start": 1,
          "end": 12
        },
        {
          "name": "bit",
          "start": 0,
          "end": 63
        }
      ],
      "semantic_role": "Bit-level dummy variables used by the XOR exactness constraints for addRoundKey."
    },
    {
      "family_id": "enc_sbox_active",
      "variable_kind": "activity_marker",
      "binary": true,
      "naming_pattern": "ae_r{round}_s{sbox}",
      "index_dimensions": [
        {
          "name": "round",
          "start": 1,
          "end": 12
        },
        {
          "name": "sbox",
          "start": 0,
          "end": 15
        }
      ],
      "semantic_role": "Activity markers for the 16 encryption S-box instances in each round."
    },
    {
      "family_id": "ks_sbox_active",
      "variable_kind": "activity_marker",
      "binary": true,
      "naming_pattern": "ak_u{update}",
      "index_dimensions": [
        {
          "name": "update",
          "start": 1,
          "end": 11
        }
      ],
      "semantic_role": "Activity markers for the single key-schedule S-box in each modeled update."
    }
  ],
  "constraint_blocks": [
    {
      "block_id": "extract_round_keys",
      "family": "key_extract_equality",
      "applies_to_unit_ids": [
        "p1_compute_12r_lower_bound_model"
      ],
      "binding_roles": {
        "source_register": "key_reg_pre_round",
        "target_round_key": "round_key_bits"
      },
      "instance_scope": {
        "round_start": 1,
        "round_end": 12,
        "bit_start": 0,
        "bit_end": 63
      },
      "index_mapping": {
        "source_round": "round",
        "source_bit": "bit + 16",
        "target_round": "round",
        "target_bit": "bit"
      },
      "semantic_summary": "Extract K1 through K12 as the left-most 64 bits of the current 80-bit key register before the update step.",
      "notes": "Matches the PRESENT-80 key schedule description in the primitive paper."
    },
    {
      "block_id": "encryption_addroundkey_xor",
      "family": "xor_bit_exact",
      "applies_to_unit_ids": [
        "p1_compute_12r_lower_bound_model"
      ],
      "binding_roles": {
        "lhs_input": "state_pre_round",
        "rhs_input": "round_key_bits",
        "output": "state_after_ark",
        "dummy": "ark_xor_dummy"
      },
      "instance_scope": {
        "round_start": 1,
        "round_end": 12,
        "bit_start": 0,
        "bit_end": 63
      },
      "paper_equation_refs": [
        "Eq. (1)",
        "Sect. 2.2 bit-level upper bound a + b + c <= 2"
      ],
      "semantic_summary": "Apply exact bit-level XOR propagation constraints to each addRoundKey bit."
    },
    {
      "block_id": "encryption_sbox_activity",
      "family": "sbox_activity_input_nonzero",
      "applies_to_unit_ids": [
        "p1_compute_12r_lower_bound_model"
      ],
      "binding_roles": {
        "input_bits": "state_after_ark",
        "activity": "enc_sbox_active"
      },
      "instance_scope": {
        "round_start": 1,
        "round_end": 12,
        "sbox_start": 0,
        "sbox_end": 15
      },
      "index_mapping": {
        "round": "round",
        "input_bit": "4 * sbox + lane",
        "activity_index": "round,sbox"
      },
      "paper_equation_refs": [
        "Eq. (3)"
      ],
      "semantic_summary": "Mark an encryption S-box active iff its 4-bit input difference is nonzero."
    },
    {
      "block_id": "encryption_sbox_bijective_link",
      "family": "sbox_bijective_nonzero",
      "applies_to_unit_ids": [
        "p1_compute_12r_lower_bound_model"
      ],
      "binding_roles": {
        "input_bits": "state_after_ark",
        "output_bits": "state_after_sbox"
      },
      "instance_scope": {
        "round_start": 1,
        "round_end": 12,
        "sbox_start": 0,
        "sbox_end": 15
      },
      "index_mapping": {
        "round": "round",
        "input_bit": "4 * sbox + lane",
        "output_bit": "4 * sbox + lane"
      },
      "paper_equation_refs": [
        "Eq. (4)"
      ],
      "semantic_summary": "Impose bijective nonzero-input/nonzero-output coupling for each 4x4 encryption S-box.",
      "notes": "Eq. (5) is intentionally omitted because the PRESENT S-box is bijective with branch number 2."
    },
    {
      "block_id": "encryption_sbox_cdp",
      "family": "sbox_valid_cutting_off",